catid,ucatid,pcatid,low_pic,category_name.en_US,category_description.en_US,category_name.de_DE,category_description.de_DE,category_name.fr_FR,category_description.fr_FR,parentKey
2,43160000,2833,,software,"Instructions for a computer's processor to perform specific operations e.g. system software such as Windows and iOS, application software such as internet browsers and apps.",Software,,logiciels,,43000000
4,43161501,55,http://images.icecat.biz/img/low_pic/4-5517.jpg,database software,A lot of applications use large complicated databases for storing information. The software in this category has been designed to make building and managing these databases fast and easy.,Datenbank-Software,"Eine Vielzahl von Anwendungen verwenden große komplizierte Datenbanken zur Speicherung von Informationen. Die Software in dieser Kategorie ist entworfen worden, um den Aufbau und die Verwaltung dieser Datenbanken schnell und einfach zu machen.",logiciels de bases de données,,43233400
7,43233004,2,http://images.icecat.biz/img/low_pic/7-3748.jpg,operating systems,"The operating system is the program that gets started first when you switch on your computer or server. All other applications depend on it for correct operation. Some examples of popular operating systems are Microsoft Windows, Mac OS and Linux.",Betriebssysteme,"Das Betriebssystem ist das Programm, das als erstes gestartet wird, wenn Sie Ihren Computerserver einschalten. Alle anderen Anwendungen sind von ihm abhängig, um korrekt zu funktionieren. Beispiele für gängige Betriebssysteme sind Microsoft Windows, Mac OS und Linux.",systèmes d'exploitation,,43160000
12,43161704,2,http://images.icecat.biz/img/low_pic/12-6685.jpg,office suites,"Set of computer programs used for work/business including a word processor, spreadsheet and presentation program. An example of an office suite is Microsoft Office.",Office-Pakete,,logiciels office,,43160000
14,43161706,2843,,financial analysis software,Computer programs that can be used for financial analysis.,Finanzanalyse Software,,logiciels d'analyse financiere,,43231600
15,43161707,2843,http://images.icecat.biz/img/low_pic/15-522.jpg,accounting software,Computer programs that can be used for accounting purposes.,Buchhaltungs-Software,,logiciels de comptabilité,,43231600
21,43232100,2,,multimedia software,"Computer programs that allow information to be presented in various formats, such as text, audio and video.",Multimedia-Software,,logiciels de multimédia,,43160000
24,43161803,21,,Optical Character Recognition (OCR) software,Optical character reader (OCR) software.,OCR Software,Optical Character Reader (OCR)-Software.,logiciels de reconnaissance optique de caractères  (ROC),Logiciel du lecteur optique (ROC).,43232100
25,43161804,21,,voice recognition software,"Computer programs that can understand the spoken words of the user. The software can do various things with the speech, such as convert it into text or use it to perform an internet search.",Spracherkennungs-Software,,logiciels de reconnaissance vocale,,43232100
26,43161805,2,,desktop publishing software,"Computer programs where the layout, contents and typography of the document can be changed by the user so a professional-looking document can be present or published.",Desktop-Publishingsoftware,,logiciels d'édition bureautique,,43160000
27,43161806,2,,presentation software,Computer programs where a slide show or other presentation can be created and presented e.g. PowerPoint,Präsentations-Software,,logiciels de présentation,,43160000
28,43161807,2,,word processors,"Computer programs which allow a user to compose, edit, format and print written material such a letter or report. A common example of a word processor is Microsoft Word.",Textverarbeitung,,logiciels de traitement de texte,,43160000
31,43161901,21,,Computer Aided Design (CAD) software,"Computer programs which allow a user to create, modify and analyse a design.",Computer Aided Design (CAD) Software,,logiciels de conception assistée par ordinateur (CAO),,43232100
32,43161902,21,http://images.icecat.biz/img/low_pic/32-2247.jpg,graphics software,Computer programs which allow a user to edit static or moving images e.g. Adobe Photoshop.,Graphik Software,,logiciels de création graphiques et photos,,43232100
38,43162001,2,http://images.icecat.biz/img/low_pic/38-4588.jpg,project management software,"Computer programs which alow a user to plan, organize and manage resources.",Projektmanagement-Software,,logiciels de gestion de projet,,43160000
42,43162101,2,,spreadsheet software,"Computer programs which allow a user to organize and analyse data in a table, and create graphs and graphics. A common example is Microsoft Excel.",Tabellenkalkulations-Software,,logiciels de feuilles de calcul,,43160000
44,43162201,21,http://images.icecat.biz/img/low_pic/44-4065.jpg,audio editing software,"Computer programs that allow audio content (e.g. music, voice recordings) to be edited.",Musik/Audio Software,,logiciels audio et musique,,43232100
47,43162302,21,,labeling software,Computer programs which allow users to create and print labels for products etc.,Beschriftungs-Software,,logiciels d'édition d'étiquettes,,43232100
51,43162403,55,http://images.icecat.biz/img/low_pic/51-5462.jpg,development software,"Development software or a programming tool is a program or application that software developers use to create, debug, or maintain other programs and applications.",Entwicklungs-Software,"Development Software oder ein ""Programmier-Tool"" ist ein Programm oder eine Anwendung, welche Software-Entwickler nutzen, um Programme oder Anwendungen zu entwickeln, zu pflegen und um Programmfehler zu bereinigen.",logiciels de développement,,43233400
55,43233400,2,,computer utilities,"Computer programs that help your computer to perform better e.g. anti-virus software, disk repair software, file management software.",PC Dienstprogramme,,utilitaires PC,,43160000
56,43162501,55,http://images.icecat.biz/img/low_pic/56-1590.jpg,backup recovery software,"Computer programs which store a ""backup"" (another copy) of your data in case the software/computer closes or crashes unexpectedly.",Backup-Recovery-Software,"Wenn Sie oder Ihr Unternehmen wichtige Daten gespeichert haben, stellen Sie sicher, dass Sie regelmäßig eine Sicherungskopie anfertigen. Stellen Sie sich einfach vor, was es bedeuten würde, eine ganz Woche Arbeit oder all Ihre Kundendaten zu verlieren: Festplatten und andere Speichermedien können und werden früher oder später abstürzen. Wählen Sie eine der Anwendungen aus diesem Bereich, und erstellen Sie Ihre Sicherungskopien schnell und einfach.",logiciels de sauvegarde ou de récupération de données,,43233400
57,43162502,55,,bar coding software,Computer programs which allow a user to create bar codes for products.,Barcode-Software,,logiciels codes barres,,43233400
58,43162503,55,,security management software,"Computer programs which allow individual files, programs or systems to be protected using passwords, face recognition etc.",Sicherheitsmanagement-Software,,logiciels de gestion de la securité,,43233400
59,43162504,21,,translation software,Computer programs which translate from one language to another.,Übersetzungs-Software,,logiciels de traduction,,43232100
60,43162505,55,,print utilities,Computer programs which allow users to manage printing devices.,Druckfunktionen,,utilitaires d'impression,,43233400
62,43162507,2,http://images.icecat.biz/img/low_pic/62-5098.jpg,antivirus security software,"Computer programs which protect computer systems, files and software from computer viruses.",Antivirus-Sicherheits-Software,"Ein Computersystem, das eine Verbindung mit dem Internet hat oder Kontakt mit dem Rest der Welt in irgendeiner anderen Weise herstellt, braucht einen Virenscanner. Die Auswirkungen von Viren reichen von harmlosen Scherzen, Verlangsamung Ihres Computers, Löschen oder Beschädigen von Dateien, Verteilung Ihrer sensiblen Daten an den Rest der Welt bis zu Zugriff auf Ihren Computer für Hacker. Viren verbreiten sich meist durch E-Mails und Programme, und jeden Tag kommen neue hinzu. Die meisten Viren sind für die gängigen Betriebssysteme konfiguriert, und ältere Versionen von Software neigen dazu, Sicherheitslücken zu haben. Stellen Sie daher sicher, dass immer einen funktionierender Virenscanner mit den neuesten Virendefinitionen auf Ihrem Computer installiert ist und vorzugsweise auch die neueste Version des Betriebssystems Ihrer Wahl.",logiciels antivirus et sécurité,,43160000
63,43162508,55,http://images.icecat.biz/img/low_pic/63-7048.jpg,general utility software,"Computer programs which make it easy to manage your computer, and help you work faster and more efficiently.",Allgemeine Utility-Software,"Diese Kategorie beinhaltet einer Vielzahl von Software, die entwickelt wurde, um die Verwaltung Ihres Computers einfach zu machen, und Ihnen zu helfen, schneller und effizienter zu arbeiten.",logiciels d'utilités générales,,43233400
65,43162510,55,,system management software,Computer programs which allow a user to view and control software and hardware on an individual device or across a network.,Systemmanagement-Software,,logiciels de gestion de systèmes,,43233400
66,43162511,55,http://images.icecat.biz/img/low_pic/66-9478.jpg,storage software,Software for managing all your storage media and stored data.,Speicher-Software,Software für die Verwaltung all Ihrer Speichermedien und der gespeicherten Daten.,logiciels de stockages,,43233400
67,43232900,2,,networking software,"Computer programs which allow a user to set up, control and manage a network or networks between computers, printers and other devices.",Netzwerk-Software,,logiciels de réseaux,,43160000
73,43162606,67,,terminal emulation software,"Computer programs which display video terminals through some another type of program, such as text.",Terminal-Emulations-Software,,logiciels d'émulation de virtualisation et de terminal,,43232900
80,43162613,67,,switch & router software,"Computer programs which controls the switch and router, which link computers in a network.",Switch & Router-Software,,logiciels de commutateurs réseaux et de routeurs,,43232900
82,43162615,67,,communications server software,"Computer program which controls a communications server, which is a carrier-grade computing system to control network infrastructure",Kommunikation-Server-Software,,logiciels de serveurs de communication,,43232900
87,43162704,67,,modem software,Computer programs which allow a user to control a modem and ensure it is functioning correctly.,Modem-Software,,logiciels de modems,,43232900
88,43162705,67,,remote access software,"Computer program which allows you to access a data system from a remote location, for example through a VPN (virtual private network).",Remote-Access-Software,,logiciels d'accès à distance,,43232900
89,43162706,21,http://images.icecat.biz/img/low_pic/89-1215.jpg,video software,Computer programs which allow videos to be displayed on a device.,Video-Software,,logiciels de vidéos,,43232100
94,43162901,2834,,video games,"Electronic games which involves a human interacting with a user interface, generating visual feedback on a video device such as a laptop, games console or handheld device.",Videospiele,,jeux vidéos,,43171900
95,43162902,21,,screen savers,"Static or moving images which appear on your computer screen after a certain amount of inactivity, the time of which can be set by the user.",Screensaver-Software,"screen saver, screen savers",économiseurs d'écrans,,43232100
98,43162905,21,,family titles,"Computer games, videos and other media that is suitable for all ages.",Familientitel,,titres des familles,,43232100
99,43162906,21,,educational software,Computer programs which aim to teach the user something e.g. software aimed at learning a language.,Lern-Software,,logiciels éducatifs,,43232100
106,43201000,2833,,computer components,A hardware component of a computer such as a hard disk or memory.,Computer-Komponenten,Eine Hardware-Komponente eines Computers.,composants,,43000000
107,43222800,2833,,telecom & navigation,"Portable computer devices and phones, and their accessories such as cables and stands",Telekommunikation und Navigation,,télécommunications et navigation,,43000000
114,43171507,242,http://images.icecat.biz/img/low_pic/114-3966.jpg,telephone switching equipment,Equipment that allows you to connect two or more different locations via telephone lines,Telefonumschalter-Zubehör,,équipements de commutation téléphonique,,43221700
115,43171508,242,,switchboard equipment,Equipment that allows you to interconnect circuits of telephones to establish telephone calls between different users.,Schaltanlagen-Zubehör,,équipements pour standard téléphonique,,43221700
117,43171510,107,http://images.icecat.biz/img/low_pic/117-1342.jpg,telephones,"Call your friends, business partners or customers with one of these great telephones!",Telefone,"Rufen Sie Ihre Freunde, Geschäftspartner oder Kunden mit einem dieser großartigen Telefone an!",téléphones,,43222800
119,43171512,107,http://images.icecat.biz/img/low_pic/119-3675.jpg,mobile phones,"A mobile phone, also known as a cellphone, mobile, or handphone, is an electronic telecommunications device with the same basic capability as a conventional fixed line telephone, but which is also entirely portable and is not required to be connected with a wire to the telephone network. With most modern cellphones you can do a lot more than just making phonecalls: with most models you can send an SMS or e-mail, surf the internet, play games, save phone numbers so you'll never have to write down or memorize them again and much, much more.",Handys,"Ein Mobiltelefon, auch bekannt als Handy, ist ein elektronisches Telekommunikations-Gerät mit den gleichen grundlegenden Fähigkeiten wie ein herkömmliches Festnetztelefon, welches aber tragbar ist und nicht mit einem Kabel an das Telefonnetz anschlossen werden muss. Die meisten modernen Handys können viel mehr als nur Telefonieren: Mit den meisten Modellen können Sie SMS oder E-Mails versenden, im Internet surfen, Spiele spielen, Telefonnummern speichern, damit Sie diese nie mehr notieren oder alle im Kopf behalten müssen und viel, viel mehr.",téléphones portables,,43222800
122,43171515,107,http://images.icecat.biz/img/low_pic/122-7860.jpg,answering machines,A machine which records a voice message when someone rings a phone and there is no answer or the line is engaged.,Anrufbeantworter,,répondeurs,,43222800
123,43171516,107,http://images.icecat.biz/img/low_pic/123-7757.jpg,mobile headsets,"A headset is just a combination of a headphone (with one or two ear plugs) and a microphone. Headsets with one ear plug are used mostly for calling hands-free, while the ones featuring a full headphone are better suited for communicating with your teammates in games.",Mobile Headsets,"Ein Headset ist einfach eine Kombination aus einem Kopfhörer (mit einem oder zwei Ohrstöpsel) und einem Mikrofon. Headsets mit einem Ohr-Stecker sind meist für Freisprecheinrichtung gedacht, während solche mit einem kompletten Kopfhörer besser für die Kommunikation mit Ihren Teamkollegen bei Spielen geeignet sind.",casques et micros,,43222800
125,43171518,242,http://images.icecat.biz/img/low_pic/125-8769.jpg,call management system,"System to control calls through to a company or organisation, such as a switchboard.",Anruf-Management-System,,systèmes de gestion d'appelles,,43221700
127,43171520,242,http://images.icecat.biz/img/low_pic/127-563.jpg,telephone rests,Device or stand where you can rest your mobile or fixed telephone.,Telefonhalterung,,autres téléphones,,43221700
137,43171613,242,http://images.icecat.biz/img/low_pic/137-386.jpg,network antennas,Device which creates a wireless network by sending out radio waves across a certain range.,Netzwerk-Antennen,,antennes,,43221700
142,43171704,242,http://images.icecat.biz/img/low_pic/142-5328.jpg,teleconferencing equipment,Equipment that permits conferences to take place in different locations by connecting participants through audio (telephone) and video devices.,Telekonferenz-Zubehör,,équipements de téléconférence,,43221700
148,43171711,242,http://images.icecat.biz/img/low_pic/148-3709.jpg,line conditioners,Device which improves the quality of power that is delivered to electric load equipment.,Leitungsverstärker,,câbles d'alimentation,,43221700
150,43171800,2833,,computers,"Device which is programmed to carry out a set of arithmetic or logical operations e.g. desktop computers, smartphones",Computer,,ordinateurs,,43000000
151,43171801,150,http://images.icecat.biz/img/low_pic/151-3223.jpg,notebooks,"A notebook, also known as laptop, is a portable computer. When you are looking for the right notebook, it is important to know where you are going to work with it. Do you want to use it on the road? Choose a model with a special energy-saving 'mobile' processor, a good battery and a reasonably small display. This will allow you to work longer with the same battery and saves you the trouble of carrying around a large display that consumes a lot of precious battery power. Or will you be using you notebook mainly in places where you will have access to a power outlet? Then choose a desktop processor (more processing power for less money) and an ordinary battery. This will save you a lot of money, which you could then spend on a bigger screen.  You'll work faster because you can view more information at once and it's great for multimedia!",Notebooks,"Ein Notebook, auch Laptop genannt, ist ein tragbarer Computer. Wenn Sie nach dem richtigen Notebook für sich suchen, ist es wichtig zu wissen, wo Sie damit arbeiten werden. Wollen Sie es unterwegs nutzen? Dann wählen Sie ein Modell mit einem speziellen energiesparenden ""Mobile""-Prozessor, einer gute Batterie und einem kleinerem Display. Dies ermöglicht Ihnen, länger  mit der gleichen Batterie zu arbeiten und erspart Ihnen außerdem die Mühe, ein großes Display herumzutragen, welches zudem noch eine Menge wertvollen Batteriestroms verbraucht. Oder werden Sie Ihr Notebook vor allem an Orten nutzen, an welchen Sie Zugriff auf eine Steckdose haben? Dann wählen Sie einen Desktop-Prozessor (mehr Rechenleistung für weniger Geld), und eine gewöhnliche Batterie. So sparen Sie eine Menge Geld, welches Sie später für auf einen größeren Bildschirm verwenden können. Sie arbeiten schneller, weil Sie mehr Informationen auf einmal sehen können und er eignet sich hervorragend für Multimedia!",notebooks,,43171800
152,43171802,151,http://images.icecat.biz/img/low_pic/152-8817.jpg,notebook docks & port replicators,"A platform into which you can install a portable computer. The docking station typically contains slots for expansion cards, bays for storage devices, and I/O connectors for peripheral devices, such as printers and monitors. Once inserted in a docking station, the portable computer essentially becomes a desktop model computer. Most importantly, the same data is accessible in both modes because it resides on the portable computer's drives. The idea behind docking stations is to let you simultaneously enjoy the expansion possibilities of desktop model computers with the portability of notebook computers. In addition, the docking station enables you to use a full-size keyboard and monitor when you're not traveling.",Notebook-Dockingstationen & Portreplikatoren,"Eine Plattform, an welche Sie einen tragbaren Computer anschließen können. Die Docking-Station verfügt normalerweise über Steckplätze für Erweiterungskarten, Slots für Speichergeräte und I / O-Anschlüsse für Peripheriegeräte wie Drucker und Monitore. Sobald Sie an eine Docking-Station angeschlossen sind, wird der tragbare Computer im Wesentlichen zu einem Desktop-Modell. Das Wichtigste dabei ist, dass die gleichen Daten in beiden Modi verfügbar sind, weil sie auf dem Laufwerk des tragbaren Computer gespeichert sind. Die Idee hinter Docking-Stationen ist es, Sie gleichzeitig die Erweiterungsmöglichkeiten der Desktop-Modell-Computer mit der Portabilität von Notebook-Computern genießen zu lassen. Darüber hinaus ermöglicht die Docking Station, Ihnen außerdem, eine Tastatur und einen Monitor in Normalgröße zu verwenden, wenn Sie nicht auf Reisen sind.",stations d'accueil,,43171801
153,43171803,150,http://images.icecat.biz/img/low_pic/153-5408.jpg,PCs/workstations,"Personal Computers, PCs for short, are computers for personal usage. They always have the following components:\r\n\r\n- A processor (CPU), this is the heart of your computer, where the data processing is done.\r\n\r\n- Memory (RAM), this is very fast memory in which temporary data is stored before being processed by the processor.\r\n\r\n- Motherboard, this is the component that connects all the different parts of your computer. Often it has some integrated components like a sound card, enabling your computer to play sound, or a network card, to connect your computer to the network.\r\n\r\n- Video board, this is the part of your computer that is responsible for the graphics processing. Micro ATX motherboards often have an integrated video board. Those integrated video boards are generally not very well suited for playing games, but good enough for watching movies.\r\n\r\n- Hard disk, this is the permanent memory of your computer where your data is stored.\r\n\r\n- An optional DVD/CD player/recorder for reading/writing DVDs/CDs.",PCs/Workstations,"Personal Computers, oder kurz PCs, sind Computer für den persönlichen Gebrauch. Sie haben immer die folgenden Komponenten:\r\n- Einen Prozessor (CPU), dies ist das Herz des Computers, in welchem die Datenverarbeitung stattfindet.\r\n- Speicher (RAM), dies ist ein sehr schneller Speicher, in welchem temporäre Daten gespeichert werden, bevor sie vom Prozessor verarbeitet und gespeichert werden.\r\n- Motherboard, dies ist die Komponente, die die verschiedenen Teile des Computers verbindet. Oft verfügt es über einige integrierte Komponenten, wie eine Soundkarte, damit Ihr Computer Klängen abspielen kann oder eine Netzwerk-Karte, um Ihren Computer mit einem Netzwerk zu verbinden.\r\n- Video Board, dies ist der Teil Ihres Computers, der verantwortlich für die Grafikbearbeitung ist. Micro ATX Motherboards haben häufig ein integriertes Video-Board. Diese integrierten Video-Boards sind in der Regel nicht sehr gut für Spiele geeignet, sind aber gut genug für Filme.\r\n- Hard Disk, dies ist der langfristige Speicher Ihres Computers, auf welchem Ihre Daten gespeichert sind.\r\n- Einen optionalen DVD-/CD-Spieler/Brenner zum Lesen/Schreiben von DVDs / CDs",PC/postes de travail,ordinateurs de bureau (PC ou Mac),43171800
154,43171804,150,http://images.icecat.biz/img/low_pic/154-2321.jpg,handheld mobile computers,Mobile computer which uses RFID (Radio Frequency Identification) e.g. scanning devices in shops and restaurants,Handheld Mobile Computer,,ordinateurs portable de poche,,43171800
155,43171805,150,http://images.icecat.biz/img/low_pic/155-8054.jpg,mainframe computers,,Mainframe Computer,,ordinateurs centraux,,43171800
156,43171806,150,http://images.icecat.biz/img/low_pic/156-5572.jpg,servers,"Extra powerful, extra reliable computers that have been specially designed for server applications. For example serving a website, a large database or shared storage space to a lot of users. Servers are often not very quiet and deliver hardly any graphical performance, which makes them not suitable for use as personal computer. If you need a lot of servers, choose a rack mountable model. Those models need less space and your server room will remain tidy.",Server,"Server sind extra starke, extra zuverlässige Computer, die speziell für Server-Anwendungen konzipiert sind. Zum Beispiel bieten Sie einer Menge von Nutzern eine Website, eine große Datenbank oder gemeinsam genutzten Speicherplatz. Die Server sind oft nicht sehr leise und liefern kaum grafische Leistung, so dass Sie nicht für den Einsatz als Personal Computer geeinget sind. Wenn Sie eine Menge von Servern benötigen, wählen Sie ein Rack-Modell. Diese Modelle benötigen weniger Platz und Ihr Server-Raum bleibt aufgeräumt.",serveurs,,43171800
159,43211505,150,http://images.icecat.biz/img/low_pic/159-5506.jpg,POS terminals,Point of sale terminals,POS-Terminal,Point of Sale-Terminals,terminaux de paiements,Terminals de point de vente,43171800
164,43201513,2844,http://images.icecat.biz/img/low_pic/164-6167.jpg,motherboards,"The motherboard or mainboard is the component that connects all the different parts of your computer. Often it has some integrated components like a sound card, enabling your computer to play sound, or a network card, to connect your computer to the network. The standard form factor (size) for motherboards is ATX, you need at least a midi-tower to fit one of those in. Micro-ATX motherboards are often more complete and have more onboard devices, like a video board and fit in smaller cases, but are generally less expandable.",Motherboards,"Das Motherboard oder Mainboard ist die Komponente, die die verschiedenen Teile des Computers verbindet. Oft verfügt es über einige integrierte Komponenten, wie eine Soundkarte, damit Ihr Computer Klängen abspielen kann oder eine Netzwerk-Karte, um Ihren Computer mit einem Netzwerk zu verbinden. Der Standard-Formfaktor (Größe) für Motherboards ist ATX. Sie benötigen mindestens einen Midi-Tower um diesen unterzubringen. Micro-ATX Motherboards fit sind oft kompletter und haben mehr Onboard-Geräte, wie z.B. ein Video Board und passen in kleineres Gehäust, sind aber in den meisten Fällen weniger erweiterbar.",cartes mères,,43201400
