catid,ucatid,pcatid,low_pic,category_name.en_US,category_description.en_US,category_name.de_DE,category_description.de_DE,category_name.fr_FR,category_description.fr_FR,parentKey
1066,43201811,287,http://images.icecat.biz/img/low_pic/1066-1192.jpg,blank DVDs,"Burn your own movies or important data to a DVD disk for storage or for sharing with family, friends and colleagues. Please be careful to purchase the right type of DVD: there is a difference between DVD+R and DVD-R recordable DVDs and not all recorders support both formats. DVD+RW disks are rewritable DVDs and DVD DL is short for DVD Dual Layer, which means you can store 8.5 GB of data on this type of DVD instead of the usual 4.7 GB.",DVD-Rohlinge,"Brennen Sie Ihre eigenen Filme oder wichtige Daten auf eine DVD zur Lagerung oder zum  Austausch mit der Familie, Freunden und Kollegen. Achten Sie darauf, die richtige Art von DVD zu kaufen: Es gibt einen Unterschied zwischen DVD-R und DVD-R beschreibbaren DVDs und nicht alle Rekorder unterstützen beide Formate. DVD-RW-Disks sind wiederbeschreibbare DVDs und DVD-DL ist die Abkürzung für Dual-Layer-DVD,auf welchen Sie 8,5 GB Daten statt der üblichen 4,7 GB Speicher speichern können.",DVDs vierges,,43180000
1069,44111911,415,http://images.icecat.biz/img/low_pic/1069-9964.jpg,whiteboards,"A glossy, usually white surface for non-permanent markings. Whiteboards are analogous to chalkboards/blackboard, allowing rapid marking and erasing of markings on their surface.",Whiteboards,,Tableaux blancs,,44111900
1070,55121619,854,http://images.icecat.biz/img/low_pic/1070-5178.jpg,non-adhesive labels,Labels that do not stick to the surface to which they are applied.,Nichtklebende Etiketten,,étiquettes non-adhésives,,14111511
1072,44103199,843,http://images.icecat.biz/img/low_pic/1072-1133.jpg,glossy white films,High-quality film which can be used for photographic prints.,Glanzfolien Weiß,,films polyesters blancs brillants,,13111200
1075,45101508,300,http://images.icecat.biz/img/low_pic/1075-3754.jpg,hole punches,Manual or electric device used for making perforations (holes) in paper.,Papier-Perforatoren u. Zubehör,,perforateurs papier,,44100000
1076,56101702,1065,http://images.icecat.biz/img/low_pic/1076-7681.jpg,filing cabinets,Piece of office furniture used to store paper documents in file folders. Normally made of metal and with 3 or 4 drawers.,Aktenschränke,,meubles de classement et accessoires,,56101700
1077,43172398,287,http://images.icecat.biz/img/low_pic/1077-2202.jpg,zip disks,"3.5"" removable disk drive from Iomega. Zip disks came in 100MB, 250MB and 750MB varieties, with the latter introduced in 2002 using USB and FireWire interfaces.The drive was bundled with software that could catalog the disks and lock the files for security.",ZIP-Disks,,disquettes Zip,,43180000
1078,52161595,220,http://images.icecat.biz/img/low_pic/1078-1722.jpg,LCD TVs,"LCD is a technology for displaying images. LCD screens are flat, thin and have a reasonably high resolution and are therefore much used as computer monitor, but are also very suitable for use in a television!",LCD-Fernseher,"LCD ist eine Technologie zur Darstellung von Bildern. LCD-Bildschirme sind flach, dünn und haben eine relativ hohe Auflösung und werden daher oft als Computer-Monitor verwendet, aber Sie sind auch sehr geeignet für den Einsatz als Fernseher!",écrans LCD,,43172400
1081,52161512,1058,http://images.icecat.biz/img/low_pic/1081-5153.jpg,loudspeakers,"Apparatus that converts electrical impulses into sound, typically as part of a public address system.",Lautsprecher,,hauts-parleurs,,52160000
1082,52161574,1058,http://images.icecat.biz/img/low_pic/1082-8603.jpg,home cinema systems,"Take the movies home with one of these fantastic home cinema systems! A home cinema system generally contains everything you need to enjoy the most realistic display of your DVDs or videogames: a DVD player, an amplifier and surround speakers with subwoofer, and it all works perfectly together. The only thing that's not included is a TV, leaving you the freedom to choose one yourself, you could even add a beamer instead of a TV, for the real home cinema experience!",Home-Kino Systeme,"Nehmen Sie die Filme mit einem dieser fantastischen Heimkino-Systeme mit nach Hause! Ein Heimkino-System enthält in der Regel alles, was Sie brauchen, um die realistische Darstellung Ihrer DVDs oder Videospiele zu genießen: einen DVD-Player, einen Verstärker und Surroundsound-Lautsprecher mit Subwoofer, und alles funktioniert perfekt zusammen. Das einzige, was nicht im Lieferumfang enthalten ist, ist ein Fernseher, so dass Sie die Freiheit haben, selbst einen auszuwählen. Man kann sogar einen statt eines Fernseher für den echten Heimkino-Erlebnis anschließen!",systèmes home cinéma,,52160000
1083,52161507,1058,http://images.icecat.biz/img/low_pic/1083-6185.jpg,radios,An apparatus for receiving radio programmes.,Radios,,Radios portables,,52160000
1086,52161526,1058,http://images.icecat.biz/img/low_pic/1086-4719.jpg,TV set-top boxes,"Device that enables a TV to receive digital, cable ot satellite signals.",TV-Set-Top-Boxen,,TV set-top boxes,,52160000
1087,52161535,1058,http://images.icecat.biz/img/low_pic/1087-6992.jpg,dictaphones,Small devices which records audio (normally speech) and can play it back at a later time.,Diktiergeräte,,dictaphones,,52160000
1088,60121526,453,http://images.icecat.biz/img/low_pic/1088-8436.jpg,calligraphy pens,Pens used to produce decorative handwriting or handwritten lettering,Kalligraphie Federn,,stylos de calligraphie,,44121700
1089,43191630,119,http://images.icecat.biz/img/low_pic/1089-4051.jpg,mobile phone starter kits,"Mobile phone, SIM card and phone charger. Other accessories such as mobile phone cases can sometimes be included.",Handy Startersets,,kits de lancement de téléphones portables,,43171512
1092,60141102,1293,http://images.icecat.biz/img/low_pic/1092-2576.jpg,board games,Games such as Monopoly or Scrabble which are played on a board.,Brettspiele,,jeux de société,,55100000
1093,60103407,1293,http://images.icecat.biz/img/low_pic/1093-2206.jpg,geographical maps,"Maps showing towns, cities, countries, continents or the world.",Landkarten,,cartes géographiques,,55100000
1094,44102911,300,http://images.icecat.biz/img/low_pic/1094-3512.jpg,cleaning wipes for office,"Cloths for cleaning offices, office furniture and office equipment.",Reinigungstücher für's Büro,,lingettes de nettoyage de bureau,,44100000
1101,44111999,415,http://images.icecat.biz/img/low_pic/1101-4548.jpg,flip charts,"Also known as a flipchart, this is a large pad of paper bound so that each page can be turned over at the top to reveal the next, used on a stand at presentations.",Flipcharts,,chevalets de conférence et accessoires,,44111900
1103,44122099,474,http://images.icecat.biz/img/low_pic/1103-4148.jpg,adhesive plastic,Plastic that sticks to the surface it is applied to.,Klebender Kunststoff,,films plastiques adhésifs,,44122000
1104,56101503,1065,http://images.icecat.biz/img/low_pic/1104-6444.jpg,coat stands,An item of furniture on which coats can be hung. It often consists of a set of hooks that are attached to a wall.,Kleiderständer,,portes-manteaux,,56101700
1105,60121508,453,http://images.icecat.biz/img/low_pic/1105-144.jpg,paint markers,A paint marker is a type of marker pen that is used to create permanent writing on a variety of surfaces from paper to metal to stone. Unlike most permanent markers the ink is an oil based paint and generally requires shaking before use. (Paint markers like permanent markers generally contain the toxic compounds xylene or toluene and require some safety when used.),Leuchtmarker,"Ein Lackstift ist eine Art Marker, der beständige Schrift auf eine Vielzahl von Oberflächen wie Papier, Metall und Stein schreibt . Anders als bei den meisten Permanentmarkern ist die Tinte  ölbasierend und Muss in der Regel vor Gebrauch geschüttelt werden. (Paint Marker wie Permanentmarker enthalten in der Regel die toxischen Verbindungen Xylol oder Toluol und erfordern einige Sicherheit beim Einsatz.)",marqueurs à peinture,,44121700
1106,60121250,403,http://images.icecat.biz/img/low_pic/1106-6571.jpg,drawing portfolios,A thin flat file of varying sizes used to contain drawings.,Zeichenmappen,,pochettes à dessins,,44111800
1107,44111516,474,http://images.icecat.biz/img/low_pic/1107-1550.jpg,personal organizers,"Small book or binder that is designed to be portable. It usually contains a diary, calendar, address book, blank paper, and other sections.",Personal Organizer,,organiseurs personnels,,44122000
1109,60121151,403,http://images.icecat.biz/img/low_pic/1109-6121.jpg,drawing boards,"Flat board that can be set at different angles, from horizonal (like a desk) to vertical (like a board). Used as a surface for technical drawings.",Zeichenbretter,,tableaux à dessin,,44111800
1110,60121999,843,http://images.icecat.biz/img/low_pic/1110-3202.jpg,T-shirt transfers,Designs which can be ironed onto T-shirts.,T-Shirt-Transfer-Folien,,papiers transferts pour T-shirt,,13111200
1111,44121626,438,http://images.icecat.biz/img/low_pic/1111-5189.jpg,adhesive remover,Chemical used to remove adhesive or glue from a surface.,Klebstoffentferner,,solvants d'adhésifs,,44121600
1112,56101514,2025,http://images.icecat.biz/img/low_pic/1112-5177.jpg,foot stools,"Usually made of plastic or wood, these are small stools used for resting feets.",Fußschemel,,tabourets,,56101100
1113,14111808,854,http://images.icecat.biz/img/low_pic/1113-4948.jpg,accounting forms & books,Books and forms which are used for accounting purposes.,Buchhaltungformulare & -Bücher,,formulaires et livres de comptabilité,,14111511
1114,14111807,854,http://images.icecat.biz/img/low_pic/1114-1887.jpg,administration books,"Books used for administrative purposes, such as diaries and accounting ledgers.",Verwaltungsbücher,,livres d'administration,,14111511
1115,82141602,1065,http://images.icecat.biz/img/low_pic/1115-1675.jpg,showcases,Cases used for displaying items or artefacts.,Schauvitrinen,,showcases,,56101700
1116,60121523,453,http://images.icecat.biz/img/low_pic/1116-3356.jpg,permanent markers,"Pens used to make a permanent mark on surfaces, such as CDs and DVDs.",Permanent Marker,,marqueurs indélébiles,,44121700
1119,60150000,2836,http://images.icecat.biz/img/low_pic/1119-7923.jpg,party supplies,Items needed for parties such as balloons and decorations.,Fest-Zubehör,,accessoires de fêtes,,60000000
1120,55121723,1065,http://images.icecat.biz/img/low_pic/1120-5267.jpg,sign holders,"Metal stands used to hold signs, such as those seen outside shops or inside conference centres.",Schildhalter,,supports de panneaux,,56101700
1121,26121699,830,http://images.icecat.biz/img/low_pic/1121-4608.jpg,SCSI cables,SCSI cables have large connectors and are mostly used to connect computer equipment such as monitors and printers.,SCSI Kabel,,câbles SCSI,,26121600
1122,43171799,242,http://images.icecat.biz/img/low_pic/1122-1061.jpg,IP communication servers,The IP (Internet Protocol) is the principle communications protocol in the internet protocol suite. IP communication servers allow IP communication.,IP Kommunikations-Server,,serveurs de communication IP,,43221700
1125,45111698,558,http://images.icecat.biz/img/low_pic/1125-5447.jpg,projector cases,Hard or padded cases used for protecting and transporting projectors.,Projektortaschen,,housses de projecteur,,45111600
1130,14111601,1147,http://images.icecat.biz/img/low_pic/1130-5694.jpg,gift wrappings,"Coloured or patterned paper, often glossy, which is used to wrap gifts.",Geschenkverpackungen,,emballages cadeaux,,24110000
1131,14111606,403,http://images.icecat.biz/img/low_pic/1131-242.jpg,art paper,"Good-quality paper, usually white, which is used for drawing or painting. Comes in various sizes including A4 and A3 .",Kunstdruckpapier,,papiers créatif,,44111800
1134,14121503,1147,http://images.icecat.biz/img/low_pic/1134-3595.jpg,cardboard,Stiff paper which is used to make boxes or placards.,Kartons,,cartons,,24110000
1135,14121504,1147,http://images.icecat.biz/img/low_pic/1135-1372.jpg,packaging paper,Strong paper which is used to pack items. Often the paper is brown.,Verpackungspapier,,papiers d'emballage,,24110000
1136,14111700,1280,,personal paper products,"Paper products used for personal hygiene, such as tissues and toilet paper.",Ausstattungspapier,,produits en papier personnel,,53130000
1137,14111703,1136,http://images.icecat.biz/img/low_pic/1137-3475.jpg,paper towels,Paper which often comes in rolls and can be separated into separate sheets. Mostly used in kitchens for cleaning or as an alternative to a napkin/serviette.,Papiertücher,,serviettes en papier,,14111700
1139,14111704,1136,http://images.icecat.biz/img/low_pic/1139-2831.jpg,toilet paper,Paper which comes in rolls and is used for personal hygiene in WCs.,Toilettenpapier,,papiers toilette,,14111700
1140,14111705,1136,http://images.icecat.biz/img/low_pic/1140-704.jpg,paper napkins,,Papierservietten,,serviettes et serviettes de table en papier,,14111700
1141,14111706,1136,http://images.icecat.biz/img/low_pic/1141-8056.jpg,paper table cloth,Large paper cloth used to cover table to protect it and for decoration.,Tischdecken (Papier),,nappes en papier,,14111700
1144,24102201,1147,http://images.icecat.biz/img/low_pic/1144-9065.jpg,stretch film dispensers,,Abroller für elastische Folien,,dérouleurs films transparents,,24110000
1147,24110000,431,,packaging materials,"Materials such as paper, card and plastic which can be used for packaging.",Verpackungsmaterialien,,matériaux d'emballage,,44121500
1148,44101799,1305,http://images.icecat.biz/img/low_pic/1148-7079.jpg,printer cables,Cables to connect printers to computers and other devices.,Druckerkabel,,cables d'imprimantes,,44101700
1149,24141501,1147,,stretch wrap films,Thin plastic film used for wrapping food etc.,Verpackungsfolien elastisch,,films étirables d'emballage,,24110000
1150,24141514,1147,http://images.icecat.biz/img/low_pic/1150-1178.jpg,packaging films,Films used for packaging items. Often made from plastic.,Verpackungsfolien,,films d'emballage,,24110000
1151,26121536,1601,,power extensions,Power extensions allow you to increase the distance between the item requiring power and the power source e.g. mains plug socket. They can also be used to increase the number of items that can be powered e.g. a four way power extension allows you to plug in four products into a single mains plug socket.,Steckdosenleiste / Stromkabel,,multiprises,,39121400
1154,30102000,1147,http://images.icecat.biz/img/low_pic/1154-6944.jpg,foil,,Folien,,papiers d'aluminium,,24110000
1155,30191599,3888,http://images.icecat.biz/img/low_pic/1155-1346.jpg,stepladders,"Piece of equipment consisting of a series of bars or steps between two upright lengths of wood, metal, or rope, used for climbing up or down something.",Trittleitern,,échelles,,30190000
1157,31162699,1065,http://images.icecat.biz/img/low_pic/1157-929.jpg,hooks,"Piece of metal or other hard material curved or bent back at an angle, for catching hold of or hanging things on.",Haken,,crochets,,56101700
1158,26121698,830,http://images.icecat.biz/img/low_pic/1158-7644.jpg,USB cables,"Cable used to connect to a USB port, which are found in desktop computers, laptops and other electronic devices.",USB Kabel,,câbles USB,,26121600
1159,31181601,438,http://images.icecat.biz/img/low_pic/1159-6610.jpg,seals,Device or substance that is used to join two things together so as to prevent them coming apart or to prevent anything passing between them.,Stempel,,sceaux,,44121600
1160,31201611,438,http://images.icecat.biz/img/low_pic/1160-4097.jpg,film adhesives,Adhesive substance used for sticking film.,Folienkleber,,films adhésifs,,44121600
1162,31211904,453,http://images.icecat.biz/img/low_pic/1162-5181.jpg,paint brushes,Brushes used for appying paint. Come in various sizes.,Lackpinsel,,pinceaux,,44121700
1163,39101600,2332,http://images.icecat.biz/img/low_pic/1163-667.jpg,bulbs,"Device for giving light, usually consisting of an electric bulb together with its holder and shade or cover.",Lampen,,ampoules,,39110000
1164,39101601,1163,http://images.icecat.biz/img/low_pic/1164-2930.jpg,halogen bulbs,Lamp with a small amount of a halogen (e.g. iodine) inside. Often used for projection and illumination.,Halogenlampen,,ampoules halogènes,,39101600
1165,39101605,1163,http://images.icecat.biz/img/low_pic/1165-3685.jpg,fluorescent bulbs,"Energy-efficient lamp. The big ones are commonly used in halls, warehouses and other big spaces. Recently compact fluorescent lamps have been developed for the home and office.",Leuchtstofflampen,,ampoules fluorescentes,,39101600
1168,39111501,2028,http://images.icecat.biz/img/low_pic/1168-3495.jpg,fluorescent fixtures,"Lighting fixture, usually attached to the ceiling, into which you can place a fluorescent bulb to get light.",Leuchtstoffbefestigungen,,plafonniers fluorescents,,56101400
1169,39111517,2028,http://images.icecat.biz/img/low_pic/1169-469.jpg,wax candles,Cylinder or block of wax with a central wick which is lit to produce light as it burns.,Wachskerzen,,bougies en cire,,56101400
1170,99999999,1,,not categorized,Does not fit in any category,nicht kategorisiert,,non classé,,
1171,39111702,2332,http://images.icecat.biz/img/low_pic/1171-1939.jpg,flashlights,"Also known as a torch, this is a portable electric light usually powered by AA or AAA batteries.",Taschenlampen,,torches et lampes de poche,,39110000
1172,39121705,830,http://images.icecat.biz/img/low_pic/1172-3399.jpg,cable clamps,Objects used to hold cables or wires in place.,Kabelklammern,,ranges-câbles et serres câbles,,26121600
1174,40101602,1744,http://images.icecat.biz/img/low_pic/1174-7729.jpg,air circulators,"A type of fan used in a warehouse, factory, or office building. Air circulators also refer to air conditioning units and other types of air cooling devices. They are designed to cool a room or area in very hot environments.",Luftumwälzer,,circulateurs d'air,,40101800
1175,40101604,1744,http://images.icecat.biz/img/low_pic/1175-3426.jpg,household fans,Apparatus with rotating blades that creates a current of air for cooling or ventilation.,Ventilatoren,,ventilateurs,,40101800
1176,40101701,1744,http://images.icecat.biz/img/low_pic/1176-6883.jpg,split-system air conditioners,A heat pump or central air conditioning system with components located both inside and outside the home. The most common design for home use.,Teilklimaanlagen,,climatiseurs split- système,,40101800
1177,40161505,1744,http://images.icecat.biz/img/low_pic/1177-8696.jpg,air filters,"Device composed of fibrous materials which removes solid particulates such as dust, pollen, mold, and bacteria from the air.",Luftfilter,,filtres d'air,,40101800
1178,41111604,403,http://images.icecat.biz/img/low_pic/1178-1727.jpg,rulers,"Straight strip or cylinder of plastic, wood, metal, or other rigid material, typically marked at regular intervals and used to draw straight lines or measure distances.",Maßstäbe,,règles,,44111800
1179,45121607,585,http://images.icecat.biz/img/low_pic/1179-8582.jpg,camera docks,"Device similar to a tripod mount, this allows its user to quickly transfer photos and videos from a camera to a computer.",Kameradocks,,stations d'accueil pour caméras,,45121600
1185,44102106,431,http://images.icecat.biz/img/low_pic/1185-9140.jpg,letter folders,Device used to fold letters.,Briefmappen,,portes-papier,,44121500
1186,44102501,300,http://images.icecat.biz/img/low_pic/1186-3713.jpg,money counting machines,Machines used for sorting and counting notes and coins.,Geldzählautomaten,,compteuses de pièces et de billets,,44100000
1188,44102904,1371,http://images.icecat.biz/img/low_pic/1188-7061.jpg,air compressed spray,"This is a spray that can be used to remove dust. It permits dry, contact-free cleaning, even in inaccessible angles and on sensitive surfaces e.g. video devices.",Druckluftspray,,vaporisateurs d'air compressé,,47131800
1190,44103507,474,http://images.icecat.biz/img/low_pic/1190-1345.jpg,binding kits,Kits used for binding documents together.,Bindegeräte,,kits de reliure,,44122000
1192,44111609,2035,http://images.icecat.biz/img/low_pic/1192-2079.jpg,counterfeit bill detectors,Machines for checking if bills (bank notes) are fake (counterfeit).,Falschgeld-Detektoren,,détecteurs de faux billets,,44111600
1193,44111806,403,http://images.icecat.biz/img/low_pic/1193-8943.jpg,protractors,A semicircular tool for measuring angles.,Winkelmesser,Eine halbkreisförmiges Werkzeug zum Messen von Winkeln.,rapporteurs,,44111800
1194,44111809,403,,drafting templates,"Shaped piece of metal, wood, card, plastic, or other material used as a pattern for processes such as painting, cutting out, shaping, or drilling.",Zeichenschablonen,,modèles brouillon,,44111800
1195,44111903,415,http://images.icecat.biz/img/low_pic/1195-9827.jpg,easels,Wooden frame for holding an artist’s work while it is being painted or drawn.,Staffeleien,,chevalets,,44111900
1196,44111905,415,http://images.icecat.biz/img/low_pic/1196-7700.jpg,dry erase boards,"Also known as a whiteboard, this is a glossy, usually white surface for nonpermanent markings.",Whiteboards,,tableaux effaçables à sec et accessoires,,44111900
1197,44111906,415,http://images.icecat.biz/img/low_pic/1197-1103.jpg,chalk boards,"Also known as a blackboard, this is a reusable writing surface on which text or drawings are made with sticks of chalk.",Kreidetafeln,,tableaux à craie et accessoires,,44111900
1198,44121627,438,http://images.icecat.biz/img/low_pic/1198-9709.jpg,bookmarks,"Strip of leather, card, or other material, used to mark one’s place in a book.",Lesezeichen,,marques-pages,,44121600
1199,44122019,474,http://images.icecat.biz/img/low_pic/1199-428.jpg,filing pockets,,Dokumentenmappen,,compartiments de classement,,44122000
1200,45141501,585,http://images.icecat.biz/img/low_pic/1200-7954.jpg,developer solution,Substance used for developing photographs.,Entwicklerlösungen,,solutions pour développeurs,,45121600
1201,45141502,585,http://images.icecat.biz/img/low_pic/1201-6090.jpg,fixatives,Substance used to keep things in position or stick them together.,Fixiermittel,,fixations,,45121600
1203,46171501,2868,http://images.icecat.biz/img/low_pic/1203-6223.jpg,padlocks,Detachable lock hanging by a pivoted hook on the object fastened.,Vorhängeschlösser,,cadenas,,46178000
1204,46171506,1065,http://images.icecat.biz/img/low_pic/1204-1394.jpg,safes,"Strong fireproof cabinet with a complex lock, used for the storage of valuables.",Safes,,coffres-forts,,56101700
1205,46171515,2868,http://images.icecat.biz/img/low_pic/1205-1843.jpg,key chains & cases,Key chains are pieces of metal which are used for carrying keys. Key cases are objects used for carrying keys.,Schlüsselketten & -Etuis,,portes-clés,,46178000
1206,46181504,1228,http://images.icecat.biz/img/low_pic/1206-7090.jpg,protective gloves,Plastic or rubber gloves worn to protect hands.,Schutzhandschuhe,,gants de protection,,46180000
1207,46181507,1228,http://images.icecat.biz/img/low_pic/1207-3072.jpg,safety vests,"Vests, often high-visibility (hi-vis), worn when working in construction and other dangerous indoor and outdoor jobs.",Sicherheitswesten,,vestes de protection,,46180000
1208,60141001,1293,http://images.icecat.biz/img/low_pic/1208-718.jpg,toy balloons,,Spielzeug Ballons,,ballons de jeu,,55100000
1209,46181704,1228,http://images.icecat.biz/img/low_pic/1209-4014.jpg,safety helmets,Hard or padded protective hat worn when doing hazardous work.,Sicherheitshelme,,casques de protection,,46180000
1210,60105808,1575,http://images.icecat.biz/img/low_pic/1210-8752.jpg,clothing care,Substances used to care for clothes such as waterproofing.,Kleidungspflege,,vêtements de protection,,53100000
1211,56112005,1065,,computer furniture parts,Parts for computer furniture such as computer desks.,Computermöbelteile,,pièces de mobilier pour ordinateurs,,56101700
1212,56112002,1065,http://images.icecat.biz/img/low_pic/1212-4721.jpg,computer desks,Desks which are used for computers.,Computerschreibtische,,bureaux d'ordinateurs,,56101700
1213,56111802,1065,http://images.icecat.biz/img/low_pic/1213-633.jpg,freestanding tables,Tables which can stand alone. They are not attached to anything.,Freistehende Tische,,tables,,56101700
1215,56101504,1065,http://images.icecat.biz/img/low_pic/1215-4136.jpg,office & computer chairs,"Separate seat for one person, typically with a back and four legs.",Büro- & Computerstühle,,chaises et fauteuils de bureau,,56101700
1216,55121718,2028,http://images.icecat.biz/img/low_pic/1216-4306.jpg,pictograms,Pictorial symbol for a word or phrase.,Hinweisschilder,,pictogrammes,,56101400
1217,55121705,1065,http://images.icecat.biz/img/low_pic/1217-6372.jpg,selfadhesive pictograms,Pictograms which can be stuck to a surface without applying any additional adhesive or glue.,selbstklebende Schilder,,pictogrammes adhésifs,,56101700
1218,55121702,854,,non-metallic nameplates,"Nameplates made from wood, plastic or other non-metallic materials. Used as signs on doors and desks.",nicht-metallische Namensschilder,,plaques non-métalliques,,14111511
1219,55121611,229,,label-making tapes,Tapes which can be used to make labels.,Etiketten erstellende Bänder,,rubans d'étiquettes,,43172504
1220,55101526,1457,http://images.icecat.biz/img/low_pic/1220-3364.jpg,dictionaries,"Book or electronic resource that lists the words of a language (typically in alphabetical order) and gives their meaning, or gives the equivalent words in a different language, often also providing information about pronunciation, origin, and usage.",Wörterbücher,,dictionnaires,,60102301
